{
  "$schema": "./shots.schema.json",
  "version": 1,
  "groups": [
    { "id": "exterior", "label": "외관", "note": "필수 8장 · 모두 같은 높이, 같은 거리에서 차를 시계 반대 방향으로 한 바퀴 돌며 찍어요." },
    { "id": "interior", "label": "실내", "note": "필수 4장 · 찍기 전에 소지품, 방향제, 거치대를 정리해 주세요." },
    { "id": "detail", "label": "디테일", "note": "선택 · 있으면 사이트가 더 풍성해져요." }
  ],
  "scenes": [
    { "id": "hero", "description": "차가 화면에 들어오는 첫 장면", "method": "video" },
    { "id": "drive", "description": "옆모습 주행 장면 (야간 주행 등)", "method": "video" },
    { "id": "rear-detail", "description": "후면을 훑는 디테일 장면", "method": "video" },
    { "id": "interior-front", "description": "운전석 → 대시보드로 이어지는 실내 장면 (실제 사진 두 장만 사용)", "method": "interpolate" },
    { "id": "interior-rear", "description": "센터콘솔 → 뒷좌석으로 이어지는 실내 장면 (실제 사진 두 장만 사용)", "method": "interpolate" },
    { "id": "closeup", "description": "휠·램프·엠블럼 클로즈업 장면", "method": "video" },
    { "id": "picker", "description": "컬러 피커용 색상별 정지 이미지", "method": "image" }
  ],
  "shots": [
    {
      "id": 1, "group": "exterior", "required": true,
      "title": "정면",
      "howTo": "차 정중앙 앞에 서서 찍어요. 양쪽 헤드라이트가 똑같은 크기로 보이면 정중앙이에요.",
      "cameraPosition": { "type": "orbit", "angleDeg": 0, "distanceM": 4, "height": "headlight" },
      "samplePhoto": "/guide/shot-01.webp",
      "usedFor": [{ "scene": "hero", "role": "reference" }]
    },
    {
      "id": 2, "group": "exterior", "required": true,
      "title": "앞쪽 대각선 (운전석 쪽)",
      "howTo": "운전석 앞바퀴 쪽으로 45도 돌아가서 찍어요. 앞면과 운전석 옆면이 함께 보여요.",
      "cameraPosition": { "type": "orbit", "angleDeg": 45, "distanceM": 4, "height": "headlight" },
      "samplePhoto": "/guide/shot-02.webp",
      "usedFor": [{ "scene": "hero", "role": "reference" }]
    },
    {
      "id": 3, "group": "exterior", "required": true,
      "title": "운전석 측면",
      "howTo": "차 옆면 정중앙에서 찍어요. 앞바퀴와 뒷바퀴가 모두 화면에 들어오게 해 주세요.",
      "cameraPosition": { "type": "orbit", "angleDeg": 90, "distanceM": 4, "height": "headlight" },
      "samplePhoto": "/guide/shot-03.webp",
      "usedFor": [{ "scene": "drive", "role": "reference" }]
    },
    {
      "id": 4, "group": "exterior", "required": true,
      "title": "뒤쪽 대각선 (운전석 쪽)",
      "howTo": "운전석 뒷바퀴 쪽으로 45도 돌아가서 찍어요. 뒷면과 운전석 옆면이 함께 보여요.",
      "cameraPosition": { "type": "orbit", "angleDeg": 135, "distanceM": 4, "height": "headlight" },
      "samplePhoto": "/guide/shot-04.webp",
      "usedFor": [{ "scene": "rear-detail", "role": "reference" }]
    },
    {
      "id": 5, "group": "exterior", "required": true,
      "title": "후면",
      "howTo": "차 정중앙 뒤에 서서 찍어요. 양쪽 테일램프가 똑같은 크기로 보이면 정중앙이에요.",
      "cameraPosition": { "type": "orbit", "angleDeg": 180, "distanceM": 4, "height": "headlight" },
      "samplePhoto": "/guide/shot-05.webp",
      "usedFor": [{ "scene": "rear-detail", "role": "reference" }]
    },
    {
      "id": 6, "group": "exterior", "required": true,
      "title": "뒤쪽 대각선 (조수석 쪽)",
      "howTo": "조수석 뒷바퀴 쪽으로 45도 돌아가서 찍어요. 뒷면과 조수석 옆면이 함께 보여요.",
      "cameraPosition": { "type": "orbit", "angleDeg": 225, "distanceM": 4, "height": "headlight" },
      "samplePhoto": "/guide/shot-06.webp",
      "usedFor": [{ "scene": "rear-detail", "role": "reference" }]
    },
    {
      "id": 7, "group": "exterior", "required": true,
      "title": "조수석 측면",
      "howTo": "차 옆면 정중앙에서 찍어요. 앞바퀴와 뒷바퀴가 모두 화면에 들어오게 해 주세요.",
      "cameraPosition": { "type": "orbit", "angleDeg": 270, "distanceM": 4, "height": "headlight" },
      "samplePhoto": "/guide/shot-07.webp",
      "usedFor": [{ "scene": "drive", "role": "reference" }]
    },
    {
      "id": 8, "group": "exterior", "required": true,
      "title": "앞쪽 대각선 (조수석 쪽)",
      "howTo": "조수석 앞바퀴 쪽으로 45도 돌아가서 찍어요. 앞면과 조수석 옆면이 함께 보여요.",
      "cameraPosition": { "type": "orbit", "angleDeg": 315, "distanceM": 4, "height": "headlight" },
      "samplePhoto": "/guide/shot-08.webp",
      "usedFor": [{ "scene": "hero", "role": "reference" }]
    },
    {
      "id": 9, "group": "interior", "required": true,
      "title": "운전석",
      "howTo": "운전석 문을 활짝 열고 밖에서 찍어요. 핸들과 시트가 함께 보이게 해 주세요.",
      "cameraPosition": { "type": "door", "door": "front-left", "aim": "운전석 핸들과 시트" },
      "samplePhoto": "/guide/shot-09.webp",
      "usedFor": [{ "scene": "interior-front", "role": "start" }]
    },
    {
      "id": 10, "group": "interior", "required": true,
      "title": "대시보드",
      "howTo": "뒷좌석 가운데에 앉아 앞을 보고 찍어요. 대시보드 전체가 화면에 들어오게 해 주세요.",
      "cameraPosition": { "type": "inside", "seat": "rear-center", "aim": "앞쪽 대시보드 전체" },
      "samplePhoto": "/guide/shot-10.webp",
      "usedFor": [{ "scene": "interior-front", "role": "end" }]
    },
    {
      "id": 11, "group": "interior", "required": true,
      "title": "센터콘솔",
      "howTo": "조수석 문을 열고 밖에서 기어와 센터콘솔 쪽을 향해 찍어요.",
      "cameraPosition": { "type": "door", "door": "front-right", "aim": "기어와 센터콘솔" },
      "samplePhoto": "/guide/shot-11.webp",
      "usedFor": [{ "scene": "interior-rear", "role": "start" }]
    },
    {
      "id": 12, "group": "interior", "required": true,
      "title": "뒷좌석",
      "howTo": "뒷문을 열고 밖에서 찍어요. 뒷좌석 전체가 보이게 해 주세요.",
      "cameraPosition": { "type": "door", "door": "rear-left", "aim": "뒷좌석 전체" },
      "samplePhoto": "/guide/shot-12.webp",
      "usedFor": [{ "scene": "interior-rear", "role": "end" }]
    },
    {
      "id": 13, "group": "detail", "required": false,
      "title": "휠 클로즈업",
      "howTo": "휠 앞에 쪼그려 앉아 휠이 화면을 가득 채우게 찍어요. 캘리퍼가 보이면 더 좋아요.",
      "cameraPosition": { "type": "closeup", "target": "wheel", "distanceM": 1 },
      "samplePhoto": "/guide/shot-13.webp",
      "usedFor": [{ "scene": "closeup", "role": "reference" }, { "scene": "picker", "role": "source" }]
    },
    {
      "id": 14, "group": "detail", "required": false,
      "title": "헤드라이트",
      "howTo": "헤드라이트를 비스듬히 가까이에서 찍어요. 불을 켜고 찍어도 좋아요.",
      "cameraPosition": { "type": "closeup", "target": "headlight", "distanceM": 0.7 },
      "samplePhoto": "/guide/shot-14.webp",
      "usedFor": [{ "scene": "closeup", "role": "reference" }, { "scene": "picker", "role": "source" }]
    },
    {
      "id": 15, "group": "detail", "required": false,
      "title": "테일램프",
      "howTo": "테일램프를 비스듬히 가까이에서 찍어요. 불을 켜고 찍어도 좋아요.",
      "cameraPosition": { "type": "closeup", "target": "taillight", "distanceM": 0.7 },
      "samplePhoto": "/guide/shot-15.webp",
      "usedFor": [{ "scene": "closeup", "role": "reference" }, { "scene": "picker", "role": "source" }]
    },
    {
      "id": 16, "group": "detail", "required": false,
      "title": "엠블럼",
      "howTo": "앞이나 뒤 엠블럼을 정면에서 가까이 찍어요. 찍은 뒤 확대해서 글자가 선명한지 확인해 주세요.",
      "cameraPosition": { "type": "closeup", "target": "emblem", "distanceM": 0.5 },
      "samplePhoto": "/guide/shot-16.webp",
      "usedFor": [{ "scene": "closeup", "role": "reference" }, { "scene": "picker", "role": "source" }]
    },
    {
      "id": 17, "group": "detail", "required": false,
      "title": "튜닝·옵션 부품",
      "howTo": "배기구, 캘리퍼, 썬루프 등 자랑하고 싶은 부분을 가까이에서 찍어요. 여러 장이어도 괜찮아요.",
      "cameraPosition": { "type": "closeup", "target": "custom", "distanceM": 1 },
      "samplePhoto": "/guide/shot-17.webp",
      "usedFor": [{ "scene": "closeup", "role": "reference" }, { "scene": "picker", "role": "source" }]
    }
  ]
}
